{
  "catalogVersion": "1.3.0",
  "owner": "underwriting-analytics",
  "approvers": [
    "chief-actuary",
    "uw-manager"
  ],
  "conventions": {
    "money": "Integer cents in computation; JSON prints dollars with up to 2 decimals. A missing paid or reserve counts as 0; a missing component incurred is paid + reserve; a printed incurred with no reserve gives reserve = incurred - paid.",
    "ratio": "round-half-away-from-zero of numerator/denominator to 6 decimals, in integer arithmetic. Null when the denominator is 0 or no claim carries the input field.",
    "days": "Whole days between ISO dates; medians printed to 1 decimal (mean of the two middle values for an even count); p90 is nearest-rank.",
    "rate": "Claims per exposure unit, 6 decimals.",
    "grain": "Account (all included claims of all documents of one quote); breakdowns by policy year (year of the policy period effective date) or by code.",
    "excluded": "Rows whose lineOfBusiness is printed and is not WC are always excluded (counted by non_wc_excluded_count). Scenario exclusions apply after that.",
    "ct": "A claim is cumulative trauma (CA LC §3208.1/§5412) when flagged CT, or nature-of-injury code 60–83, or cause code 97/98, or type-of-loss 02/03, or the description says cumulative / CT / repetitive. Post-termination when the date of injury is on or after the claimant's last day worked: the claim's own lastDayWorked when the carrier prints it, else the quote context's account-level date (report 10 answer 1).",
    "notMeasurable": "A metric whose value is null prints notMeasurable with the reason: the missing input (no payroll / no FTE count in the submission context; no last day worked; no litigation flag, recoveries or cause / body-part / nature codes printed; no valuation date), else 'no contributing claims'. Added in 1.1.0 with claim.lastDayWorked.",
    "fromSummary": "ADR 0017 (brief 18): a summary-only loss run prints period rows (counts, paid / reserve / incurred) and no claims. fromSummary: yes marks the metrics computed from those rows (LossRun.Analytics.PeriodSummaries; by-year breakdowns keyed by the printed period label); every other metric is notMeasurable for a summary-only document. Claim-level metrics and the what-if scenario see only claim rows. Added in 1.2.0."
  },
  "scenario": {
    "description": "What-if parameters (underwriter-analytics.md KQ2). Applied identically by server and client; the baseline is the scenario with every parameter at its default.",
    "order": [
      "excludeClaimIds",
      "includeNonCA",
      "includeCT",
      "excludeCatastrophicAbove",
      "trendFactorBpsByYear",
      "reserveFactorBps",
      "capPerClaim"
    ],
    "parameters": [
      {
        "name": "excludeClaimIds",
        "type": "string[]",
        "default": [],
        "description": "Claims removed from every metric."
      },
      {
        "name": "includeNonCA",
        "type": "boolean",
        "default": true,
        "description": "false removes claims whose jurisdiction is printed and is not CA (CA experience rating uses CA losses only)."
      },
      {
        "name": "includeCT",
        "type": "boolean",
        "default": true,
        "description": "false removes cumulative-trauma claims."
      },
      {
        "name": "excludeCatastrophicAbove",
        "type": "money|null",
        "default": null,
        "description": "Removes claims whose as-reported total incurred is above this amount (catastrophic / shock losses)."
      },
      {
        "name": "trendFactorBpsByYear",
        "type": "map<policyYear,int>",
        "default": {},
        "description": "Multiplies every paid and reserve amount of the policy year's claims, in basis points (10500 = x1.05)."
      },
      {
        "name": "reserveFactorBps",
        "type": "int",
        "default": 0,
        "description": "Changes every reserve by this many basis points (+1000 = +10 %, -500 = -5 %)."
      },
      {
        "name": "capPerClaim",
        "type": "money|null",
        "default": null,
        "description": "Limits each claim's total incurred; the limit consumes paid amounts first (indemnity, medical, expense), then reserves in the same order (Variance, Catastrophes and WC ratemaking)."
      }
    ]
  },
  "metrics": [
    {
      "name": "claim_count",
      "label": "Claim count",
      "description": "Number of included claims.",
      "type": "simple",
      "unit": "count",
      "fromSummary": "yes",
      "expr": "count(claim)",
      "agg": "count",
      "nulls": "Never null; 0 for an account with no claims.",
      "inputs": [
        {
          "field": "claim.claimNumber",
          "transformation": "AGGREGATION"
        }
      ],
      "valuation": "As of each document's valuation date; late-reported claims (IBNR) are not on the run.",
      "tolerance": {
        "kind": "exact"
      },
      "owner": "underwriting-analytics"
    },
    {
      "name": "claim_count_with_financials",
      "label": "Claims with financials",
      "description": "Included claims that carry financials: claim_count less the claims recorded for reporting only (claim.reportOnly; a census-only status or an incident indicator). Shown beside claim_count, so a count is read with both totals (brief 22 Answers 4). Added in 1.3.0.",
      "type": "simple",
      "unit": "count",
      "fromSummary": "no",
      "expr": "count(claim where reportOnly is not true)",
      "agg": "count",
      "filters": [
        "reportOnly is not true"
      ],
      "nulls": "Never null; equals claim_count when no claim is flagged report-only.",
      "inputs": [
        {
          "field": "claim.claimNumber",
          "transformation": "AGGREGATION"
        },
        {
          "field": "claim.reportOnly",
          "transformation": "AGGREGATION"
        }
      ],
      "valuation": "As of each document's valuation date; a census-only claim gains financials at a later valuation.",
      "tolerance": {
        "kind": "exact"
      },
      "owner": "underwriting-analytics"
    },
    {
      "name": "open_claim_count",
      "label": "Open claims",
      "description": "Claims whose status is open or reopened.",
      "type": "simple",
      "unit": "count",
      "fromSummary": "yes",
      "expr": "count(claim where status in (open, reopened))",
      "agg": "count",
      "filters": [
        "status in (open, reopened)"
      ],
      "nulls": "Claims with no status are not counted.",
      "inputs": [
        {
          "field": "claim.status",
          "transformation": "AGGREGATION"
        }
      ],
      "valuation": "Open at the valuation date; a later valuation may close them.",
      "tolerance": {
        "kind": "exact"
      },
      "owner": "underwriting-analytics"
    },
    {
      "name": "closed_claim_count",
      "label": "Closed claims",
      "description": "Claims whose status is closed.",
      "type": "simple",
      "unit": "count",
      "fromSummary": "yes",
      "expr": "count(claim where status = closed)",
      "agg": "count",
      "filters": [
        "status = closed"
      ],
      "nulls": "Claims with no status are not counted.",
      "inputs": [
        {
          "field": "claim.status",
          "transformation": "AGGREGATION"
        }
      ],
      "valuation": "Closed claims can reopen (development reason 3, §B4).",
      "tolerance": {
        "kind": "exact"
      },
      "owner": "underwriting-analytics"
    },
    {
      "name": "reopened_claim_count",
      "label": "Reopened claims",
      "description": "Claims whose status is reopened.",
      "type": "simple",
      "unit": "count",
      "fromSummary": "no",
      "expr": "count(claim where status = reopened)",
      "agg": "count",
      "filters": [
        "status = reopened"
      ],
      "nulls": "Claims with no status are not counted.",
      "inputs": [
        {
          "field": "claim.status",
          "transformation": "AGGREGATION"
        }
      ],
      "valuation": "Only reopenings printed on this run; a reopening detected across valuations needs two runs (rule S14).",
      "tolerance": {
        "kind": "exact"
      },
      "owner": "underwriting-analytics"
    },
    {
      "name": "medical_only_count",
      "label": "Medical-only claims",
      "description": "Claims of type medical-only.",
      "type": "simple",
      "unit": "count",
      "fromSummary": "no",
      "expr": "count(claim where claimType = medicalOnly)",
      "agg": "count",
      "filters": [
        "claimType = medicalOnly"
      ],
      "nulls": "Claims of unknown type are counted in neither medical-only nor lost-time.",
      "inputs": [
        {
          "field": "claim.claimType",
          "transformation": "AGGREGATION"
        }
      ],
      "valuation": "A medical-only claim can convert to indemnity later (rule S8).",
      "tolerance": {
        "kind": "exact"
      },
      "owner": "underwriting-analytics"
    },
    {
      "name": "lost_time_count",
      "label": "Lost-time claims",
      "description": "Claims of type indemnity (lost time).",
      "type": "simple",
      "unit": "count",
      "fromSummary": "no",
      "expr": "count(claim where claimType = indemnity)",
      "agg": "count",
      "filters": [
        "claimType = indemnity"
      ],
      "nulls": "Claims of unknown type are not counted.",
      "inputs": [
        {
          "field": "claim.claimType",
          "transformation": "AGGREGATION"
        }
      ],
      "valuation": "As printed at the valuation date.",
      "tolerance": {
        "kind": "exact"
      },
      "owner": "underwriting-analytics"
    },
    {
      "name": "lost_time_share",
      "label": "Lost-time share",
      "description": "Lost-time claims as a share of all claims (national rule of thumb 20–25 %, §B3).",
      "type": "ratio",
      "unit": "ratio",
      "fromSummary": "no",
      "expr": "lost_time_count / claim_count",